{
  "schema_version": 1,
  "input": {
    "path": "tests/fixtures/synthetic_minimal.itch",
    "sha256": null,
    "trading_date": "2019-01-30",
    "exchange_timezone": "America/New_York"
  },
  "selection": {
    "symbols": ["AAPL"],
    "session_start_ns": 34200000000000,
    "session_end_ns": 57600000000000,
    "require_trading_state": false
  },
  "output": {
    "depth": 2,
    "emit_unchanged_trade_snapshots": false
  },
  "validation": {
    "mode": "strict",
    "max_skipped_messages": 0,
    "invariant_interval": 1
  }
}
